{
  "apiVersion": 1,
  "id": "example/dense-product-ui",
  "version": "0.1.0-draft",
  "title": "Dense Product UI",
  "description": "Guidance for preserving scan-friendly comparison and deliberate information density in product interfaces.",
  "owner": "AnyPixel Next contributors",
  "license": "Apache-2.0",
  "entries": [
    {
      "id": "dense/comparison",
      "kind": "guide",
      "path": "skills/improve-dense-screen/references/comparison.md",
      "topics": ["tables", "comparison", "information-density"]
    },
    {
      "id": "dense/invoice-example",
      "kind": "example",
      "path": "skills/improve-dense-screen/references/invoice-example.md",
      "topics": ["tables", "invoices", "responsive"]
    }
  ],
  "skills": ["skills/improve-dense-screen"],
  "recommendedChecks": ["web/axe"]
}
